{
  "version": "2.0",
  "project_name": "zeroscan",
  "mission": "The Zero-Scan, Git-Aware Context Engine for AI Coding Agents",
  "current_phase": "Phase 2 - Engine Maturation",
  "status": "IN_PROGRESS",
  "active_task": "Automated CI/CD validation tests",
  "verified_commit": "ab4a7f9992b009911114075a554d14330c4ab25b",
  "last_updated": "2026-09-29T00:27:59.330391+00:00",
  "metrics": {
    "bootstrap_context_bytes": 2393,
    "max_allowed_bytes": 10240,
    "budget_limit_bytes": 10240,
    "budget_used_percent": 23.37,
    "is_within_budget": true,
    "total_agent_system_bytes": 36374,
    "completed_tasks_count": 3,
    "file_breakdown": {
      "BOOT.md": 764,
      "PROJECT_STATE.json": 909,
      "NEXT_TASK.md": 720
    }
  },
  "constraints": [
    "Keep bootstrap context <= 10 KB",
    "Follow MEMORY_PROTOCOL.md strictly",
    "Verify all changes with tests before checkpointing"
  ]
}
